{
  "schema_version": "1.0",
  "role": "lead",
  "title": "World Architect / Lead",
  "input_schema": "agent_input",
  "output_schema": "lead_plan",
  "stages": [
    "planning"
  ],
  "prompt_file": "resources/agents/lead.md",
  "claude_file": ".claude/agents/lead.md",
  "required_capabilities": [],
  "forbidden_capabilities": [
    "canon_write",
    "canon_apply",
    "human_approval",
    "git_mutation"
  ]
}
