{
  "schema_version": "1.0",
  "role": "researcher",
  "title": "Researcher",
  "input_schema": "agent_input",
  "output_schema": "research_result",
  "stages": [
    "independent",
    "cross_review"
  ],
  "prompt_file": "resources/agents/researcher.md",
  "claude_file": ".claude/agents/researcher.md",
  "required_capabilities": [
    "source_search",
    "source_read"
  ],
  "forbidden_capabilities": [
    "canon_write",
    "canon_apply",
    "human_approval",
    "git_mutation"
  ]
}
