{
  "schema_version": "1.0",
  "role": "redteam",
  "title": "Red Team",
  "input_schema": "agent_input",
  "output_schema": "redteam_result",
  "stages": [
    "redteam"
  ],
  "prompt_file": "resources/agents/redteam.md",
  "claude_file": ".claude/agents/redteam.md",
  "required_capabilities": [],
  "forbidden_capabilities": [
    "canon_write",
    "canon_apply",
    "human_approval",
    "git_mutation"
  ]
}
