{
  "schema_version": "1.0",
  "role": "engineering_auditor",
  "title": "Physics / Engineering Auditor",
  "input_schema": "agent_input",
  "output_schema": "engineering_result",
  "stages": [
    "independent",
    "cross_review"
  ],
  "prompt_file": "agents/engineering_auditor.md",
  "claude_file": ".claude/agents/engineering-auditor.md",
  "required_capabilities": [
    "python_calculation"
  ],
  "forbidden_capabilities": [
    "canon_write",
    "canon_apply",
    "human_approval",
    "git_mutation"
  ]
}
